{
  "schema": "trusted-govuk-discovery.evidence-trace-collection.v1",
  "generatedAt": "2026-08-30T00:00:00Z",
  "catalogueBundleDigest": "20593105f6e34d5072f566b4f7b98cab143c4333c56bbabfca831b935237945c",
  "answerPackSourceDigest": "ea00549f465ef4d7fc65c9e5853ee2b78ab6d9823d25e9268516d7b955d70f1f",
  "traces": [
    {
      "schema": "trusted-govuk-discovery.evidence-trace.v1",
      "id": "answer:new-child-starting-points",
      "question": "Which GOV.UK sources should I check after a baby is born?",
      "answerSummary": "This catalogue identifies official GOV.UK starting points for registering a birth, checking Child Benefit and checking maternity or paternity leave, pay or Maternity Allowance.",
      "scope": "This is a directory answer based on captured page metadata. It does not decide eligibility, replace current guidance or provide legal or financial advice.",
      "claimIds": [
        "claim:register-a-birth",
        "claim:check-child-benefit",
        "claim:check-parental-pay-and-leave"
      ],
      "nodes": [
        {
          "id": "answer:new-child-starting-points",
          "kind": "answer",
          "label": "Directory answer",
          "statement": "This catalogue identifies official GOV.UK starting points for registering a birth, checking Child Benefit and checking maternity or paternity leave, pay or Maternity Allowance.",
          "facets": {
            "authority": "Curated directory answer over admitted source metadata",
            "assertionStatus": "normalised",
            "verification": "source-linked",
            "freshness": {
              "status": "not-established",
              "note": "The answer has no independent freshness claim; its sources retain their observation dates."
            },
            "integrity": {
              "status": "sha256-bound",
              "digest": "20593105f6e34d5072f566b4f7b98cab143c4333c56bbabfca831b935237945c",
              "note": "Every selected record is bound to the validated catalogue bundle."
            },
            "access": {
              "status": "not-applicable",
              "note": "The answer grants no access or permission."
            },
            "rights": {
              "status": "not-applicable",
              "note": "Rights remain attached to each cited source record."
            },
            "coverage": {
              "status": "bounded",
              "note": "3 selected starting points from the 80-record catalogue; not exhaustive."
            }
          }
        },
        {
          "id": "check:check-child-benefit-digest",
          "kind": "check",
          "label": "Packaged integrity check",
          "statement": "The source record, evidence receipt and catalogue bundle bindings passed deterministic SHA-256 checks.",
          "recordId": "govuk-discovery:govuk-content:aed2cee3-7ca8-4f00-ab17-9193fff516ae",
          "facets": {
            "authority": "Local deterministic validation runtime",
            "assertionStatus": "not-applicable",
            "verification": "digest-bound",
            "freshness": {
              "status": "observed",
              "observedAt": "2026-07-15T06:24:43.049674+00:00",
              "note": "No freshness deadline is asserted; use the authoritative page for current information."
            },
            "integrity": {
              "status": "sha256-bound",
              "digest": "131baa6c79e1decedd7e8b3ec72a548a9ea67e01bc085c4eb6b4f6f58b41bd8b",
              "note": "The packaged record passed its SHA-256 binding checks."
            },
            "access": {
              "status": "public",
              "note": "The captured official metadata declares anonymous access to the human page."
            },
            "rights": {
              "status": "confirmed",
              "title": "Open Government Licence v3.0 for reused GOV.UK metadata, where applicable",
              "note": "Contains public sector information licensed under the Open Government Licence v3.0 where applicable."
            },
            "coverage": {
              "status": "one-record",
              "note": "Integrity was checked for this packaged record, not for the current live page."
            }
          }
        },
        {
          "id": "check:check-parental-pay-and-leave-digest",
          "kind": "check",
          "label": "Packaged integrity check",
          "statement": "The source record, evidence receipt and catalogue bundle bindings passed deterministic SHA-256 checks.",
          "recordId": "govuk-discovery:govuk-content:1f6b4ecc-ce2c-488a-b9c7-b78b3bba5598",
          "facets": {
            "authority": "Local deterministic validation runtime",
            "assertionStatus": "not-applicable",
            "verification": "digest-bound",
            "freshness": {
              "status": "observed",
              "observedAt": "2026-07-15T06:24:22.929662+00:00",
              "note": "No freshness deadline is asserted; use the authoritative page for current information."
            },
            "integrity": {
              "status": "sha256-bound",
              "digest": "1ad55fe3e43173e292d3fb34d31519d85391b7cc4085e2d3191ef028ecefe964",
              "note": "The packaged record passed its SHA-256 binding checks."
            },
            "access": {
              "status": "public",
              "note": "The captured official metadata declares anonymous access to the human page."
            },
            "rights": {
              "status": "confirmed",
              "title": "Open Government Licence v3.0 for reused GOV.UK metadata, where applicable",
              "note": "Contains public sector information licensed under the Open Government Licence v3.0 where applicable."
            },
            "coverage": {
              "status": "one-record",
              "note": "Integrity was checked for this packaged record, not for the current live page."
            }
          }
        },
        {
          "id": "check:register-a-birth-digest",
          "kind": "check",
          "label": "Packaged integrity check",
          "statement": "The source record, evidence receipt and catalogue bundle bindings passed deterministic SHA-256 checks.",
          "recordId": "govuk-discovery:govuk-content:28389deb-8fd3-44dc-95a9-e7d1935ac363",
          "facets": {
            "authority": "Local deterministic validation runtime",
            "assertionStatus": "not-applicable",
            "verification": "digest-bound",
            "freshness": {
              "status": "observed",
              "observedAt": "2026-07-15T06:24:25.034371+00:00",
              "note": "No freshness deadline is asserted; use the authoritative page for current information."
            },
            "integrity": {
              "status": "sha256-bound",
              "digest": "9487e6e1bda0f0e041d507f6b38bbd21734ba6f0efb6779086adec1980d5c833",
              "note": "The packaged record passed its SHA-256 binding checks."
            },
            "access": {
              "status": "public",
              "note": "The captured official metadata declares anonymous access to the human page."
            },
            "rights": {
              "status": "confirmed",
              "title": "Open Government Licence v3.0 for reused GOV.UK metadata, where applicable",
              "note": "Contains public sector information licensed under the Open Government Licence v3.0 where applicable."
            },
            "coverage": {
              "status": "one-record",
              "note": "Integrity was checked for this packaged record, not for the current live page."
            }
          }
        },
        {
          "id": "claim:check-child-benefit",
          "kind": "claim",
          "label": "Child Benefit",
          "statement": "GOV.UK has Child Benefit guidance covering rates, eligibility and how to claim.",
          "recordId": "govuk-discovery:govuk-content:aed2cee3-7ca8-4f00-ab17-9193fff516ae",
          "facets": {
            "authority": "Curated deterministic normalisation of cited official metadata",
            "assertionStatus": "normalised",
            "verification": "source-linked",
            "freshness": {
              "status": "observed",
              "observedAt": "2026-07-15T06:24:43.049674+00:00",
              "note": "No freshness deadline is asserted; use the authoritative page for current information."
            },
            "integrity": {
              "status": "sha256-bound",
              "digest": "131baa6c79e1decedd7e8b3ec72a548a9ea67e01bc085c4eb6b4f6f58b41bd8b",
              "note": "The packaged record passed its SHA-256 binding checks."
            },
            "access": {
              "status": "public",
              "note": "The captured official metadata declares anonymous access to the human page."
            },
            "rights": {
              "status": "confirmed",
              "title": "Open Government Licence v3.0 for reused GOV.UK metadata, where applicable",
              "note": "Contains public sector information licensed under the Open Government Licence v3.0 where applicable."
            },
            "coverage": {
              "status": "one-record",
              "note": "One selected statement within a bounded directory answer."
            }
          }
        },
        {
          "id": "claim:check-parental-pay-and-leave",
          "kind": "claim",
          "label": "Check if you can get Maternity or Paternity Leave or Pay, or Maternity Allowance",
          "statement": "GOV.UK has a service for checking maternity or paternity leave or pay, or Maternity Allowance.",
          "recordId": "govuk-discovery:govuk-content:1f6b4ecc-ce2c-488a-b9c7-b78b3bba5598",
          "facets": {
            "authority": "Curated deterministic normalisation of cited official metadata",
            "assertionStatus": "normalised",